<?xml version = "1.0" encoding = "UTF-8"?>
<AnalysisChains
   xmlns:xsi="http://www.w3.org/2001/XMLSchema-instance"
   xsi:noNamespaceSchemaLocation=
   "http://www.openmicroscopy.org/XMLschemas/AnalysisModule/IR3/AnalysisChain.xsd">

  <AnalysisChain
     Name="Find and track spots" Locked="false">

    <Nodes>
      <Node NodeID="Importer" ProgramName="Importer"/>
      <Node NodeID="Stack" ProgramName="Stack statistics"/>
      <Node NodeID="Find" ProgramName="Find spots"/>
      <Node NodeID="Track" ProgramName="Track spots"/>
    </Nodes>

    <Links>
      <Link FromNodeID="Importer" FromOutputName="Pixels"
            ToNodeID="Stack" ToInputName="Pixels"/>

      <Link FromNodeID="Importer" FromOutputName="Pixels"
            ToNodeID="Find" ToInputName="Pixels"/>

      <Link FromNodeID="Importer" FromOutputName="Dimensions"
            ToNodeID="Track" ToInputName="Dimensions"/>

      <Link FromNodeID="Stack" FromOutputName="Minima"
            ToNodeID="Find" ToInputName="Stack minima"/>
      <Link FromNodeID="Stack" FromOutputName="Maxima"
            ToNodeID="Find" ToInputName="Stack maxima"/>
      <Link FromNodeID="Stack" FromOutputName="Mean"
            ToNodeID="Find" ToInputName="Stack means"/>
      <Link FromNodeID="Stack" FromOutputName="Geomean"
            ToNodeID="Find" ToInputName="Stack geomeans"/>
      <Link FromNodeID="Stack" FromOutputName="Sigma"
            ToNodeID="Find" ToInputName="Stack sigmas"/>

      <Link FromNodeID="Find" FromOutputName="Location"
            ToNodeID="Track" ToInputName="Location"/>
      <Link FromNodeID="Find" FromOutputName="Timepoint"
            ToNodeID="Track" ToInputName="Timepoint"/>
    </Links>
  </AnalysisChain>

</AnalysisChains>
