<?xml version = "1.0" encoding = "UTF-8"?>
<!--
#~~~~~~~~~~~~~~~~~~~~~~~~~~~~~~~~~~~~~~~~~~~~~~~~~~~~~~~~~~~~~~~~~~~~~~~~~~~~~~~
#
# Copyright (C) 2003 Open Microscopy Environment
#       Massachusetts Institue of Technology,
#       National Institutes of Health,
#       University of Dundee
#
#
#
#    This library is free software; you can redistribute it and/or
#    modify it under the terms of the GNU Lesser General Public
#    License as published by the Free Software Foundation; either
#    version 2.1 of the License, or (at your option) any later version.
#
#    This library is distributed in the hope that it will be useful,
#    but WITHOUT ANY WARRANTY; without even the implied warranty of
#    MERCHANTABILITY or FITNESS FOR A PARTICULAR PURPOSE.  See the GNU
#    Lesser General Public License for more details.
#
#    You should have received a copy of the GNU Lesser General Public
#    License along with this library; if not, write to the Free Software
#    Foundation, Inc., 59 Temple Place, Suite 330, Boston, MA  02111-1307  USA
#
#~~~~~~~~~~~~~~~~~~~~~~~~~~~~~~~~~~~~~~~~~~~~~~~~~~~~~~~~~~~~~~~~~~~~~~~~~~~~~~~
-->

<!--
#~~~~~~~~~~~~~~~~~~~~~~~~~~~~~~~~~~~~~~~~~~~~~~~~~~~~~~~~~~~~~~~~~~~~~~~~~~~~~~~
# Written by: 
#~~~~~~~~~~~~~~~~~~~~~~~~~~~~~~~~~~~~~~~~~~~~~~~~~~~~~~~~~~~~~~~~~~~~~~~~~~~~~~~
-->

<AnalysisChains
   xmlns:xsi="http://www.w3.org/2001/XMLSchema-instance"
   xsi:noNamespaceSchemaLocation=
   "http://www.openmicroscopy.org/XMLschemas/AnalysisModule/IR3/AnalysisChain.xsd">

  <AnalysisChain
     Name="HandE Stained Nucleii Counter" Locked="false">

    <Nodes>
	  <Node NodeID = "Files" ProgramName = "Original files"/>
	  <Node NodeID = "Import" ProgramName = "Image import"/>
      <Node NodeID="HandE Colour Deconvolution"
      		ProgramName="Haematoxylin Eosin Colour Deconvolution"/>
	  <Node NodeID="StackStats"
            ProgramName="Stack statistics (image server)"/>
      <Node NodeID="Find Nucleii" ProgramName="Find spots"/>
    </Nodes>

    <Links>
      <Link FromNodeID="Files" FromOutputName="Files"
            ToNodeID="Import" ToInputName="Files"/>
	  <Link
         FromNodeID="Import" FromOutputName="Pixels"
         ToNodeID="HandE Colour Deconvolution" ToInputName="RGB Pixels"/>
	  <Link
         FromNodeID="HandE Colour Deconvolution" FromOutputName="Haematoxylin Staining"
         ToNodeID="StackStats" ToInputName="Pixels"/>
      <Link FromNodeID="Import" FromOutputName="Pixels"
            ToNodeID="Find Nucleii" ToInputName="Pixels"/>
      <Link FromNodeID="StackStats" FromOutputName="Minima"
            ToNodeID="Find Nucleii" ToInputName="Stack minima"/>
      <Link FromNodeID="StackStats" FromOutputName="Maxima"
            ToNodeID="Find Nucleii" ToInputName="Stack maxima"/>
      <Link FromNodeID="StackStats" FromOutputName="Mean"
            ToNodeID="Find Nucleii" ToInputName="Stack means"/>
      <Link FromNodeID="StackStats" FromOutputName="Geomean"
            ToNodeID="Find Nucleii" ToInputName="Stack geomeans"/>
      <Link FromNodeID="StackStats" FromOutputName="Sigma"
            ToNodeID="Find Nucleii" ToInputName="Stack sigmas"/>
	 <Link FromNodeID="StackStats" FromOutputName="Geosigma"
            ToNodeID="Find Nucleii" ToInputName="Stack geosigmas"/>
    </Links>
  </AnalysisChain>

`</AnalysisChains>
