<?xml version = "1.0" encoding = "UTF-8"?>
<!--
#~~~~~~~~~~~~~~~~~~~~~~~~~~~~~~~~~~~~~~~~~~~~~~~~~~~~~~~~~~~~~~~~~~~~~~~~~~~~~~~
#
# Copyright (C) 2003 Open Microscopy Environment
#       Massachusetts Institute of Technology,
#       National Institutes of Health,
#       University of Dundee
#
#
#
#    This library is free software; you can redistribute it and/or
#    modify it under the terms of the GNU Lesser General Public
#    License as published by the Free Software Foundation; either
#    version 2.1 of the License, or (at your option) any later version.
#
#    This library is distributed in the hope that it will be useful,
#    but WITHOUT ANY WARRANTY; without even the implied warranty of
#    MERCHANTABILITY or FITNESS FOR A PARTICULAR PURPOSE.  See the GNU
#    Lesser General Public License for more details.
#
#    You should have received a copy of the GNU Lesser General Public
#    License along with this library; if not, write to the Free Software
#    Foundation, Inc., 59 Temple Place, Suite 330, Boston, MA  02111-1307  USA
#
#~~~~~~~~~~~~~~~~~~~~~~~~~~~~~~~~~~~~~~~~~~~~~~~~~~~~~~~~~~~~~~~~~~~~~~~~~~~~~~~
-->




<!--
#~~~~~~~~~~~~~~~~~~~~~~~~~~~~~~~~~~~~~~~~~~~~~~~~~~~~~~~~~~~~~~~~~~~~~~~~~~~~~~~
# Written by:  Josiah Johnston <siah@nih.gov>
#~~~~~~~~~~~~~~~~~~~~~~~~~~~~~~~~~~~~~~~~~~~~~~~~~~~~~~~~~~~~~~~~~~~~~~~~~~~~~~~
-->



<AnalysisChains xmlns:xsi="http://www.w3.org/2001/XMLSchema-instance" xsi:noNamespaceSchemaLocation="http://www.openmicroscopy.org/XMLschemas/AnalysisModule/IR3/AnalysisChain.xsd">
	<AnalysisChain Name = "Signature Chains" Locked = "false">
		<Nodes>
	        <Node NodeID = "Files" ProgramName = "Original files"/>
	        <Node NodeID = "Import" ProgramName = "Image import"/>
			<Node NodeID = "maxIntensity" ProgramName = "Maximum Intensity Projection"/>
			<Node NodeID = "AreaStats" ProgramName = "Area Statistics"/>
			<Node NodeID = "Zernike" ProgramName = "Zernike Coefficients Order 3x2"/>
		</Nodes>
		<Links>
            <Link FromNodeID="Files" FromOutputName="Files"
                  ToNodeID="Import" ToInputName="Files"/>
			<Link FromNodeID="Import" FromOutputName="Other metadata" ToNodeID="maxIntensity" ToInputName="ChannelIndex"/>
			<Link FromNodeID="maxIntensity" FromOutputName="PixelsPlane" ToNodeID="AreaStats" ToInputName="PixelsPlane"/>
			<Link FromNodeID="maxIntensity" FromOutputName="PixelsPlane" ToNodeID="Zernike" ToInputName="PixelsPlane"/>
		</Links>
	</AnalysisChain>
	<AnalysisChain Name = "Hull Statistics" Locked = "false">
		<Nodes>
			<Node NodeID = "Import" ProgramName = "Importer"/>
			<Node NodeID = "maxIntensity" ProgramName = "Maximum Intensity Projection"/>
			<Node NodeID = "HullStat" ProgramName = "Hull Statistics"/>
		</Nodes>
		<Links>
			<Link FromNodeID="Import" FromOutputName="Other metadata" ToNodeID="maxIntensity" ToInputName="ChannelIndex"/>
			<Link FromNodeID="maxIntensity" FromOutputName="PixelsPlane" ToNodeID="HullStat" ToInputName="PixelsPlane"/>
		</Links>
	</AnalysisChain>
</AnalysisChains>
