<?xml version = "1.0" encoding = "UTF-8"?>
<!--
#~~~~~~~~~~~~~~~~~~~~~~~~~~~~~~~~~~~~~~~~~~~~~~~~~~~~~~~~~~~~~~~~~~~~~~~~~~~~~~~
#
# Copyright (C) 2003 Open Microscopy Environment
#       Massachusetts Institue of Technology,
#       National Institutes of Health,
#       University of Dundee
#
#
#
#    This library is free software; you can redistribute it and/or
#    modify it under the terms of the GNU Lesser General Public
#    License as published by the Free Software Foundation; either
#    version 2.1 of the License, or (at your option) any later version.
#
#    This library is distributed in the hope that it will be useful,
#    but WITHOUT ANY WARRANTY; without even the implied warranty of
#    MERCHANTABILITY or FITNESS FOR A PARTICULAR PURPOSE.  See the GNU
#    Lesser General Public License for more details.
#
#    You should have received a copy of the GNU Lesser General Public
#    License along with this library; if not, write to the Free Software
#    Foundation, Inc., 59 Temple Place, Suite 330, Boston, MA  02111-1307  USA
#
#~~~~~~~~~~~~~~~~~~~~~~~~~~~~~~~~~~~~~~~~~~~~~~~~~~~~~~~~~~~~~~~~~~~~~~~~~~~~~~~
-->




<!--
#~~~~~~~~~~~~~~~~~~~~~~~~~~~~~~~~~~~~~~~~~~~~~~~~~~~~~~~~~~~~~~~~~~~~~~~~~~~~~~~
# Written by:  Tom Macura <tmacura@nih.gov>
#~~~~~~~~~~~~~~~~~~~~~~~~~~~~~~~~~~~~~~~~~~~~~~~~~~~~~~~~~~~~~~~~~~~~~~~~~~~~~~~
-->



<AnalysisChains xmlns:xsi = "http://www.w3.org/2001/XMLSchema-instance" xsi:noNamespaceSchemaLocation = "http://www.openmicroscopy.org/XMLschemas/AnalysisModule/IR3/AnalysisChain.xsd">
	<AnalysisChain Name = "Image Histogram Chain" Locked = "false">
		<Nodes>
			<Node NodeID = "Files" ProgramName = "Original files"/>
			<Node NodeID = "Import" ProgramName = "Image import"/>
			<Node NodeID = "PlanesHist" ProgramName = "Plane Histogram (from OMEIS)"/>
			<Node NodeID = "StacksHist" ProgramName = "Stack Histogram (from OMEIS)"/>
		</Nodes>
		<Links>
			<Link FromNodeID="Files"  FromOutputName="Files"  ToNodeID="Import"     ToInputName="Files"/>
			<Link FromNodeID="Import" FromOutputName="Pixels" ToNodeID="PlanesHist" ToInputName="Pixels"/>
			<Link FromNodeID="Import" FromOutputName="Pixels" ToNodeID="StacksHist" ToInputName="Pixels"/>
		</Links>
	</AnalysisChain>
</AnalysisChains>
